### ISSUE TITLE
smartdns多端口并发查询异常

### ISSUE THREAD

**Issue by HateBaozi** [pymumu/smartdns#1166]
**问题现象**  
SmartDNS里设置了2个分组端口，用于分别查询国内和国外DNS
如果chinadns-ng使用同时查询smartdns 2个端口的数据，会造成分组查询失败，smartdns只会返回其中一个分组的数据
如果在命令行分别查询2个端口的数据，返回结果正常

感觉像是处理并发请求的情况下有问题

**运行环境**
1. 固件型号  
自编译OpenWrt 21.03

2. 运营商  
联通

3. smartdns来源以及版本
2022.38.1
opkg从openwrt库更新

4. 涉及的配置(注意去除个人相关信息)

**重现步骤**
1. 上游DNS配置。  

**SmartDNS配置如下**

force-AAAA-SOA yes
speed-check-mode none
cache-persist no
cache-size 0
log-level debug
log-file /tmp/overwall.log
bind :5335 -group a
bind :5336 -group i -no-rule-soa
server-tcp 8.8.8.8 -group a -exclude-default-group
server-tcp 223.5.5.5 -group i -exclude-default-group

**chinaDNS-ng命令如下**

/usr/bin/chinadns-ng -l 5337 -c 127.0.0.1#5336 -t 127.0.0.1#5335 -f -n -v

2. 访问的域名。  
www.google.com

**dig向chinadns-ng查询数据，返回的是了5336端口对应分组的数据，而且smartdns的日志显示2次请求都只向223.5.5.5发送了请求，没有请求8.8.8.8**

# dig www.google.com @127.0.0.1 -p 5337

; <<>> DiG 9.17.20 <<>> www.google.com @127.0.0.1 -p 5337
;; global options: +cmd
;; Got answer:
;; ->>HEADER<<- opcode: QUERY, status: NOERROR, id: 53677
;; flags: qr rd ra; QUERY: 1, ANSWER: 1, AUTHORITY: 0, ADDITIONAL: 1

;; OPT PSEUDOSECTION:
; EDNS: version: 0, flags:; udp: 1408
;; QUESTION SECTION:
;www.google.com.                        IN      A

;; ANSWER SECTION:
www.google.com.         600     IN      A       108.160.165.48

;; Query time: 10 msec
;; SERVER: 127.0.0.1#5337(127.0.0.1) (UDP)
;; WHEN: Sun Nov 13 00:28:54 CST 2022
;; MSG SIZE  rcvd: 59

**tcpdump抓包，证实chinadns向5335和5336端口都发送了请求**
00:28:54.140851 IP 127.0.0.1.55282 > 127.0.0.1.5336: UDP, length 55
00:28:54.140888 IP 127.0.0.1.36989 > 127.0.0.1.5335: UDP, length 55
00:28:54.146931 IP 127.0.0.1.5336 > 127.0.0.1.55282: UDP, length 59
00:28:54.146990 IP 127.0.0.1.5335 > 127.0.0.1.36989: UDP, length 59

**查看smartdns日志，chinadns往5335端口和5336端口的两个请求都只向5336端口的对应分组发送了请求，可以看到没有请求8.8.8.8**

[2022-11-13 00:28:54,140][DEBUG][     dns_server.c:4213] recv query packet from 127.0.0.1, len = 55, type = 0
[2022-11-13 00:28:54,141][DEBUG][            dns.c:1631] opt type 10
[2022-11-13 00:28:54,141][DEBUG][     dns_server.c:4225] request qdcount = 1, ancount = 0, nscount = 0, nrcount = 0, len = 55, id = 256, tc = 0, rd = 1, ra = 0, rcode = 0
[2022-11-13 00:28:54,141][ INFO][     dns_server.c:4243] query server www.google.com from 127.0.0.1, qtype = 1
[2022-11-13 00:28:54,141][DEBUG][     dns_client.c:539 ] send query to group i
[2022-11-13 00:28:54,141][DEBUG][     dns_client.c:2845] send query to server 223.5.5.5
[2022-11-13 00:28:54,141][ INFO][     dns_client.c:3135] send request www.google.com, qtype 1, id 5
[2022-11-13 00:28:54,141][DEBUG][     dns_server.c:4213] recv query packet from 127.0.0.1, len = 55, type = 0
[2022-11-13 00:28:54,141][DEBUG][            dns.c:1631] opt type 10
[2022-11-13 00:28:54,141][DEBUG][     dns_server.c:4225] request qdcount = 1, ancount = 0, nscount = 0, nrcount = 0, len = 55, id = 256, tc = 0, rd = 1, ra = 0, rcode = 0
[2022-11-13 00:28:54,141][ INFO][     dns_server.c:4243] query server www.google.com from 127.0.0.1, qtype = 1
[2022-11-13 00:28:54,146][DEBUG][     dns_client.c:2202] recv tcp packet from 223.5.5.5, len = 61
[2022-11-13 00:28:54,146][DEBUG][     dns_client.c:1605] qdcount = 1, ancount = 1, nscount = 0, nrcount = 0, len = 59, id = 5, tc = 0, rd = 1, ra = 1, rcode = 0, payloadsize = 1408
[2022-11-13 00:28:54,146][DEBUG][     dns_client.c:1616] domain: www.google.com qtype: 1  qclass: 1
[2022-11-13 00:28:54,146][DEBUG][     dns_server.c:2855] query result from server 223.5.5.5: 53, type: 1
[2022-11-13 00:28:54,146][DEBUG][     dns_server.c:2573] domain: www.google.com TTL: 45 IP: 108.160.165.48
[2022-11-13 00:28:54,146][DEBUG][     dns_server.c:969 ] cache www.google.com qtype: 1 ttl: 600
[2022-11-13 00:28:54,147][DEBUG][     dns_client.c:1395] result: www.google.com, qtype: 1, hasresult: 1, id 5

**单独用dig请求5335和5336分组，结果和查询日志都正常**

# dig www.google.com @127.0.0.1 -p 5335

; <<>> DiG 9.17.20 <<>> www.google.com @127.0.0.1 -p 5335
;; global options: +cmd
;; Got answer:
;; ->>HEADER<<- opcode: QUERY, status: NOERROR, id: 62092
;; flags: qr rd ra; QUERY: 1, ANSWER: 1, AUTHORITY: 0, ADDITIONAL: 1

;; OPT PSEUDOSECTION:
; EDNS: version: 0, flags:; udp: 512
;; QUESTION SECTION:
;www.google.com.                        IN      A

;; ANSWER SECTION:
www.google.com.         600     IN      A       172.217.27.36

;; Query time: 140 msec
;; SERVER: 127.0.0.1#5335(127.0.0.1) (UDP)
;; WHEN: Sun Nov 13 00:31:00 CST 2022
;; MSG SIZE  rcvd: 59

**请求了8.8.8.8**
[2022-11-13 00:31:00,592][DEBUG][     dns_server.c:4213] recv query packet from 127.0.0.1, len = 55, type = 0
[2022-11-13 00:31:00,592][DEBUG][            dns.c:1631] opt type 10
[2022-11-13 00:31:00,592][DEBUG][     dns_server.c:4225] request qdcount = 1, ancount = 0, nscount = 0, nrcount = 0, len = 55, id = 62092, tc = 0, rd = 1, ra = 0, rcode = 0
[2022-11-13 00:31:00,592][ INFO][     dns_server.c:4243] query server www.google.com from 127.0.0.1, qtype = 1
[2022-11-13 00:31:00,592][DEBUG][     dns_client.c:539 ] send query to group a
[2022-11-13 00:31:00,592][DEBUG][     dns_client.c:2845] send query to server 8.8.8.8
[2022-11-13 00:31:00,592][DEBUG][     dns_client.c:1768] tcp server 8.8.8.8 connecting.
[2022-11-13 00:31:00,592][ INFO][     dns_client.c:3135] send request www.google.com, qtype 1, id 6
[2022-11-13 00:31:00,592][DEBUG][     dns_client.c:2296] tcp server 8.8.8.8 connected
[2022-11-13 00:31:00,732][DEBUG][     dns_client.c:2202] recv tcp packet from 8.8.8.8, len = 61
[2022-11-13 00:31:00,732][DEBUG][     dns_client.c:1605] qdcount = 1, ancount = 1, nscount = 0, nrcount = 0, len = 59, id = 6, tc = 0, rd = 1, ra = 1, rcode = 0, payloadsize = 512
[2022-11-13 00:31:00,732][DEBUG][     dns_client.c:1616] domain: www.google.com qtype: 1  qclass: 1
[2022-11-13 00:31:00,732][DEBUG][     dns_server.c:2855] query result from server 8.8.8.8: 53, type: 1
[2022-11-13 00:31:00,732][DEBUG][     dns_server.c:2573] domain: www.google.com TTL: 72 IP: 172.217.27.36
[2022-11-13 00:31:00,732][DEBUG][     dns_server.c:969 ] cache www.google.com qtype: 1 ttl: 600
[2022-11-13 00:31:00,732][DEBUG][     dns_client.c:1395] result: www.google.com, qtype: 1, hasresult: 1, id 6
[2022-11-13 00:31:02,734][DEBUG][     dns_client.c:1148] server 8.8.8.8 closed.
[2022-11-13 00:31:02,734][DEBUG][     dns_client.c:2277] peer close, 8.8.8.8

# dig www.google.com @127.0.0.1 -p 5336

; <<>> DiG 9.17.20 <<>> www.google.com @127.0.0.1 -p 5336
;; global options: +cmd
;; Got answer:
;; ->>HEADER<<- opcode: QUERY, status: NOERROR, id: 2759
;; flags: qr rd ra; QUERY: 1, ANSWER: 1, AUTHORITY: 0, ADDITIONAL: 1

;; OPT PSEUDOSECTION:
; EDNS: version: 0, flags:; udp: 1408
;; QUESTION SECTION:
;www.google.com.                        IN      A

;; ANSWER SECTION:
www.google.com.         600     IN      A       80.87.199.46

;; Query time: 10 msec
;; SERVER: 127.0.0.1#5336(127.0.0.1) (UDP)
;; WHEN: Sun Nov 13 00:31:29 CST 2022
;; MSG SIZE  rcvd: 59

**请求了223.5.5.5**

[2022-11-13 00:31:29,612][DEBUG][     dns_server.c:4213] recv query packet from 127.0.0.1, len = 55, type = 0
[2022-11-13 00:31:29,613][DEBUG][            dns.c:1631] opt type 10
[2022-11-13 00:31:29,613][DEBUG][     dns_server.c:4225] request qdcount = 1, ancount = 0, nscount = 0, nrcount = 0, len = 55, id = 2759, tc = 0, rd = 1, ra = 0, rcode = 0
[2022-11-13 00:31:29,613][ INFO][     dns_server.c:4243] query server www.google.com from 127.0.0.1, qtype = 1
[2022-11-13 00:31:29,613][DEBUG][     dns_client.c:539 ] send query to group i
[2022-11-13 00:31:29,613][DEBUG][     dns_client.c:2845] send query to server 223.5.5.5
[2022-11-13 00:31:29,613][ INFO][     dns_client.c:3135] send request www.google.com, qtype 1, id 7
[2022-11-13 00:31:29,618][DEBUG][     dns_client.c:2202] recv tcp packet from 223.5.5.5, len = 61
[2022-11-13 00:31:29,618][DEBUG][     dns_client.c:1605] qdcount = 1, ancount = 1, nscount = 0, nrcount = 0, len = 59, id = 7, tc = 0, rd = 1, ra = 1, rcode = 0, payloadsize = 1408
[2022-11-13 00:31:29,618][DEBUG][     dns_client.c:1616] domain: www.google.com qtype: 1  qclass: 1
[2022-11-13 00:31:29,618][DEBUG][     dns_server.c:2855] query result from server 223.5.5.5: 53, type: 1
[2022-11-13 00:31:29,618][DEBUG][     dns_server.c:2573] domain: www.google.com TTL: 145 IP: 80.87.199.46
[2022-11-13 00:31:29,618][DEBUG][     dns_server.c:969 ] cache www.google.com qtype: 1 ttl: 600
[2022-11-13 00:31:29,618][DEBUG][     dns_client.c:1395] result: www.google.com, qtype: 1, hasresult: 1, id 7

**信息收集**  
1. 将/var/log/smrtdns.log日志作为附件上传(注意去除个人相关信息)。  
2. 如进程异常，请将coredump功能开启，上传coredump信息文件，同时上传配套的smartdns进程文件。  
在自定义界面，开启设置->自定义设置->生成coredump配置，重现问题后提交coredump文件
coredump文件在/tmp目录下

**Comment by HateBaozi** [comment]
经验证，smartdns.1.2020.02.25-2212，无此问题

**Comment by PikuZheng** [comment]
试下这个改动能不能缓解

https://github.com/pymumu/smartdns/commit/09389f20aa9020242872145541f4783df107a8a6

**Comment by openips** [comment]
国外全用tcp协议的dns试试

**Comment by HateBaozi** [comment]
> 试下这个改动能不能缓解
> 
> [09389f2](https://github.com/pymumu/smartdns/commit/09389f20aa9020242872145541f4783df107a8a6)

注释了这段肯定可以呀，应该是里面hash key没有把groupname加进去，加进去应该就好

**Comment by HateBaozi** [comment]
> 貌似有点问题 确定8.8.8.8走代理吗

确定，你看单独查询5335端口那段返回，返回了正确的IP

**Comment by PikuZheng** [comment]
哦 那清楚了 等作者修吧 🤣 看了你的问题描述我就想到是这个原因了，而且终于知道了开两个端口对应不同组的问题究竟出在哪里。。。

#1086 #1042 #1053 #1121 应该都是这个问题

**Comment by pymumu** [comment]
什么场景同一个域名要从两个端口请求两次？

**Comment by HateBaozi** [comment]
> 什么场景同一个域名要从两个端口请求两次？

chinadns-ng
https://github.com/zfl9/chinadns-ng

因为chinadns-ng只支持udp，所以我使用smartdns作为它的上游，然后smartdns通过doh分组请求国内外dns
chinadns根据两组dns的返回来决策信任哪一个

**Comment by HateBaozi** [comment]
> 哦 那清楚了 等作者修吧 🤣 看了你的问题描述我就想到是这个原因了，而且终于知道了开两个端口对应不同组的问题究竟出在哪里。。。
> 
> #1086 #1042 #1053 #1121 应该都是这个问题

是的，应该都是一个问题

**Comment by HateBaozi** [comment]
> > 什么场景同一个域名要从两个端口请求两次？
> 
> chinadns-ng https://github.com/zfl9/chinadns-ng
> 
> 因为chinadns-ng只支持udp，所以我使用smartdns作为它的上游，然后smartdns通过分组使用doh请求国内外dns chinadns根据两组dns的返回来决策信任哪一个

**Comment by rampageX** [comment]
> 什么场景同一个域名要从两个端口请求两次？

大部分支持自动分流的 dns 转发软件都是并发向上级 国内/国外 两组服务器同时查询，然后通过对比 CIDR 等方式保留相应结果。

**Comment by cncqcyc** [comment]
> > 什么场景同一个域名要从两个端口请求两次？
> 
> chinadns-ng https://github.com/zfl9/chinadns-ng
> 
> 因为chinadns-ng只支持udp，所以我使用smartdns作为它的上游，然后smartdns通过doh分组请求国内外dns。 chinadns再根据两组dns的返回来决策信任哪一个

你不配置黑白名单？chinadns-ng特别说了它只是单纯转发，配合黑白名单也只是起到一定的防污染作用，既然使用smartdns分组查询就应该是分组里的二选一，否则失去分组的意义，你用国内dns查询被墙的域名从逻辑上就错了，如果你使用了代理，应该在代理那里就先做dns分流这样才安全

**Comment by PikuZheng** [comment]
> 你不配置黑白名单？chinadns-ng特别说了它只是单纯转发，配合黑白名单也只是起到一定的防污染作用，既然使用smartdns分组查询就应该是分组里的二选一，否则失去分组的意义，你用国内dns查询被墙的域名从逻辑上就错了，如果你使用了代理，应该在代理那里就先做dns分流这样才安全

从逻辑上来说 用国内和国外服务器同时查询一个域名并根据返回的不同ip（geoip）来决定使用哪个的确是错误的解决方案 但是好像大家都想要这么用 好多issue都是这个问题

**Comment by cncqcyc** [comment]
> > 你不配置黑白名单？chinadns-ng特别说了它只是单纯转发，配合黑白名单也只是起到一定的防污染作用，既然使用smartdns分组查询就应该是分组里的二选一，否则失去分组的意义，你用国内dns查询被墙的域名从逻辑上就错了，如果你使用了代理，应该在代理那里就先做dns分流这样才安全
> 
> 从逻辑上来说 用国内和国外服务器同时查询一个域名并根据返回的不同ip（geoip）来决定使用哪个是错误的解决方案 但是好像大家都想要这么用 好多issue都是这个问题

是的，很多issue确实是这方面的问题，smartdns分组查询和多上游同时查询是它的强大的核心功能之一，但多上游查询应该只限于组内，我们通常的分组基本上就是为了国内国外上网分组，国外分组必须得全程通过代理，否则就不安全，dns的分流要么使用smartdns的domain-rules功能，要么使用其它代理软件的dns分流功能，最终的目的是在使用smartdns的查询功能之前实现了分流功能，做到国内走国内，国外走国外，不应该出现国外域名或者被墙的域名还走国内的情况

**Comment by HateBaozi** [comment]
> 

黑白名单配置了，但是gfwlist不能完整的覆盖所有的情况，总有新的域名受影响。
我觉得chinadns-ng的机制很满足我的需求，同时查询国内外DNS，如果国内DNS返回的是国外IP，就使用国外DNS的返回，这种应该基本能处理绝大部分的DNS污染情况

**Comment by HateBaozi** [comment]
> > 你不配置黑白名单？chinadns-ng特别说了它只是单纯转发，配合黑白名单也只是起到一定的防污染作用，既然使用smartdns分组查询就应该是分组里的二选一，否则失去分组的意义，你用国内dns查询被墙的域名从逻辑上就错了，如果你使用了代理，应该在代理那里就先做dns分流这样才安全
> 
> 从逻辑上来说 用国内和国外服务器同时查询一个域名并根据返回的不同ip（geoip）来决定使用哪个是错误的解决方案 但是好像大家都想要这么用 好多issue都是这个问题

因为这种处理DNS污染的方式很灵活，不需要依赖和更新一个额外的domain-list

**Comment by HateBaozi** [comment]
> > > 你不配置黑白名单？chinadns-ng特别说了它只是单纯转发，配合黑白名单也只是起到一定的防污染作用，既然使用smartdns分组查询就应该是分组里的二选一，否则失去分组的意义，你用国内dns查询被墙的域名从逻辑上就错了，如果你使用了代理，应该在代理那里就先做dns分流这样才安全
> > 
> > 
> > 从逻辑上来说 用国内和国外服务器同时查询一个域名并根据返回的不同ip（geoip）来决定使用哪个是错误的解决方案 但是好像大家都想要这么用 好多issue都是这个问题
> 
> 是的，很多issue确实是这方面的问题，smartdns分组查询和多上游同时查询是它的强大的核心功能之一，但多上游查询应该只限于组内，我们通常的分组基本上就是为了国内国外上网分组，国外分组必须得全程通过代理，否则就不安全，dns的分流要么使用smartdns的domain-rules功能，要么使用其它代理软件的dns分流功能，最终的目的是在使用smartdns的查询功能之前实现了分流功能，做到国内走国内，国外走国外，不应该出现国外域名或者被墙的域名还走国内的情况

是的，smartdns直接用其实也符合需求了，有一个实时更新的domain-list就OK

**Comment by jxph1123** [comment]
我直接用ssrplus里面的gfwlist或绕过大陆IP，好像也没问题，何必再套一个chinadns-ng

**Comment by HateBaozi** [comment]
> 

如果gfwlist能解决所有需求，当然可以了，就是不灵活

**Comment by kulongwangzhi85** [comment]
想法是正确，类似v2ray的Fallback，回退功能。
在smartdns分组中，使用白名单，如果返回的ip不匹配，是否会继续查询其它分组？以及是否排除哪些分组？
如果支持Fallback，就不必这么麻烦了！

**Comment by pymumu** [comment]
问题是同记录合并查询到这的问题
这种查询模式，并行查询会导致dns泄漏

可以试试smartdns的black-ip-list，和white-ip-list，这个和chnroute是一样的

**Comment by HateBaozi** [comment]
> -r -f -n -b 0.0.0.0 -c 127.0.0.1#33051 -t 127.0.0.1#33052 -M -m /usr/chn.txt -g /usr/gfw.txt -4 /usr/4.txt -6 /usr/6.txt
> 
> chnlist+gfwlist+chnroute v4+chnroute v6的模式才是chinadns ng的完全体

gfwlist里面没有，但是又被污染的域名怎么办

**Comment by HateBaozi** [comment]
> 问题是同记录合并查询到这的问题 这种查询模式，并行查询会导致dns泄漏
> 
> 可以试试smartdns的black-ip-list，和white-ip-list，这个和chnroute是一样的

DNS泄漏这个问题我确实没考虑到，我研究下这两个list

**Comment by kulongwangzhi85** [comment]
> white-ip-list

cn组内所有大陆dns服务器，都使用white-ip白名单，然后在cn同组内，再添加1.1.1.1与8.8.8.8上游dns服务器。这两个不用添加白名单。
你得先保证这两个dns服务器能从隧道出去，或者不被污染！
我是这么用的。早上刚改的。不知道有没什么问题。

之前都是用v2ray的dns，因为有回退功能。可以指定当域名解析到的地址非cn国内的，可以使用其它指定的上游dns。比较方便。

**Comment by pymumu** [comment]
https://github.com/pymumu/smartdns/tree/seprate-cache
拆分了查询缓存，可以试试。

**Comment by HateBaozi** [comment]
> https://github.com/pymumu/smartdns/tree/seprate-cache
> 拆分了查询缓存，可以试试。

没问题了，改动还不小，辛苦大佬了

**Comment by rampageX** [comment]
> [`seprate-cache`](https://github.com/pymumu/smartdns/tree/seprate-cache?rgh-link-date=2022-11-17T15%3A32%3A20Z) 拆分了查询缓存，可以试试。

初步测试没什么问题了，感谢！
